{
  "schema_version": 1,
  "type": "report",
  "title": "Weekly Sales Review",
  "subtitle": "Deterministic Office automation fixture",
  "sections": [
    {
      "title": "Executive Summary",
      "blocks": [
        {
          "type": "paragraph",
          "text": "Weekly GMV reached {{fact:total_gmv_cny.display_value}} from {{fact:total_orders.display_value}} orders, with conversion rate at {{fact:conversion_rate.display_value}}.",
          "fact_refs": ["total_gmv_cny", "total_orders", "conversion_rate"]
        },
        {
          "type": "metrics",
          "items": [
            {
              "label": "GMV",
              "fact_ref": "total_gmv_cny"
            },
            {
              "label": "Orders",
              "fact_ref": "total_orders"
            },
            {
              "label": "Conversion rate",
              "fact_ref": "conversion_rate"
            }
          ]
        }
      ]
    },
    {
      "title": "Commercial Notes",
      "blocks": [
        {
          "type": "bullets",
          "items": [
            {
              "text": "Top region by GMV was {{fact:top_region_by_gmv.display_value}}.",
              "fact_refs": ["top_region_by_gmv"]
            },
            {
              "text": "Top channel by GMV was {{fact:top_channel_by_gmv.display_value}}.",
              "fact_refs": ["top_channel_by_gmv"]
            },
            {
              "text": "Average order value was {{fact:average_order_value_cny.display_value}}.",
              "fact_refs": ["average_order_value_cny"]
            }
          ]
        }
      ]
    },
    {
      "title": "Risks And Action Items",
      "blocks": [
        {
          "type": "paragraph",
          "text": "Risks and action items are taken from the meeting notes. Keep inventory review and regional follow-up visible in the next operating cycle.",
          "fact_refs": []
        }
      ]
    }
  ]
}
